{
  "id": "pkt-transport-refresh-001",
  "type": "transport-refresh",
  "token_id": "tok-workflow-triage",
  "version": "0.1.0",
  "state": "suspended",
  "scope_hash": "sha256:scope-workflow-triage-v2",
  "declaration": {
    "claim_id": "claim-workflow-triage-heldout",
    "old_law": {
      "law_hash": "sha256:mission-law-v1"
    },
    "new_law": {
      "law_hash": "sha256:mission-law-v2"
    },
    "bridge": {
      "type": "density-ratio",
      "max_ratio": 1.25
    }
  },
  "evidence": {
    "transport_diagnostics": "finite support coverage and bounded drift"
  },
  "bounds": {
    "transport_upper_bound": 1.0
  },
  "validity": {
    "transport": {
      "status": "valid",
      "covered_receiver_class": "software-maintenance-agent"
    }
  },
  "monitor": {
    "deadline": "P7D",
    "staleness_alarm": "support-gap-detected"
  },
  "fallback": {
    "action": "remain-suspended"
  },
  "signatures": []
}
