{
  "id": "pkt-deprecation-001",
  "type": "deprecation",
  "token_id": "tok-workflow-triage",
  "version": "0.3.0",
  "state": "active",
  "scope_hash": "sha256:scope-workflow-triage-v1",
  "declaration": {
    "scope": {
      "receiver_class": "software-maintenance-agent",
      "context_law": "heldout-repository-repair"
    },
    "reason": "baseline refresh removed positive certified margin"
  },
  "evidence": {
    "audit_record": "audit-baseline-refresh-v2"
  },
  "bounds": {
    "value_upper_bound": 2.0,
    "cost_lower_bound": 2.5,
    "risk_lower_bound": 0.0,
    "transport_lower_bound": 0.0
  },
  "validity": {
    "hazard": {
      "status": "valid"
    }
  },
  "monitor": {
    "deprecation_scope": "baseline-refresh-v2"
  },
  "fallback": {
    "action": "deprecate",
    "resurrection_rule": "new admission packet must address baseline-refresh-v2"
  },
  "signatures": []
}
