{
  "id": "pkt-monitor-alarm-001",
  "type": "monitor-alarm",
  "token_id": "tok-workflow-triage",
  "version": "0.3.0",
  "state": "active",
  "scope_hash": "sha256:scope-workflow-triage-v1",
  "declaration": {
    "claim_id": "claim-workflow-triage-heldout",
    "alarm_scope": "telemetry-and-drift"
  },
  "evidence": {
    "alarm_statistic": {
      "name": "transport-drift-score",
      "value": 0.82,
      "threshold": 0.75
    }
  },
  "bounds": {
    "reserve_charge": 1.0
  },
  "validity": {
    "monitor": {
      "status": "triggered"
    }
  },
  "monitor": {
    "alarm": "transport drift exceeded declared envelope"
  },
  "fallback": {
    "action": "suspend"
  },
  "signatures": []
}
