{
  "id": "pkt-resurrection-001",
  "type": "resurrection",
  "token_id": "tok-workflow-triage",
  "version": "0.4.0",
  "state": "deprecated",
  "scope_hash": "sha256:scope-workflow-triage-v2",
  "declaration": {
    "old_negative_certificate_id": "pkt-deprecation-001",
    "repair_summary": "new evidence addresses baseline-refresh-v2"
  },
  "evidence": {
    "overwriting_evidence": "new heldout certification split"
  },
  "bounds": {
    "value_lower_bound": 8.0,
    "cost_upper_bound": 2.0,
    "risk_upper_bound": 1.0,
    "transport_upper_bound": 1.0,
    "raw_net_capital_lower_bound": 3.0
  },
  "validity": {
    "hazard": {
      "status": "valid"
    },
    "finality": {
      "state": "finalized"
    }
  },
  "monitor": {
    "status": "resurrection"
  },
  "fallback": {
    "action": "return-to-candidate"
  },
  "signatures": []
}
